{
  "schema_version": "argus.experiment_batch_request.v1alpha1",
  "batch_id": "experiment-batch-example-1",
  "baseline_evaluation_run_id": "evaluation-baseline-1",
  "variant_evaluation_run_id": "evaluation-variant-1",
  "experiment_run_id": "experiment-run-example-1",
  "experiment_revision": "experiment-revision-1",
  "variable": "prompt",
  "executor_revision": "argus-local-formal-pi-replay-1",
  "max_concurrency": 2,
  "cases": [
    {
      "case_id": "case-example-1",
      "expected_label_revision": 1,
      "baseline_review_run_id": "review-baseline-1",
      "expected_baseline_config_sha256": "eeeeeeeeeeeeeeeeeeeeeeeeeeeeeeeeeeeeeeeeeeeeeeeeeeeeeeeeeeeeeeee",
      "expected_variant_config_sha256": "ffffffffffffffffffffffffffffffffffffffffffffffffffffffffffffffff",
      "exposure_observations": [
        { "component": "prompt", "status": "not_seen", "revision": "prompt-2" },
        { "component": "rule", "status": "not_seen", "revision": "rule-1" },
        { "component": "model", "status": "not_seen", "revision": "model-1" },
        { "component": "index", "status": "not_seen", "revision": "index-1" }
      ]
    }
  ],
  "created_at": "2026-08-25T10:00:00Z"
}
